{
  "id": "1a2b3c4d-5e6f-4a7b-8c9d-0e1f2a3b4c5d",
  "coding_session_id": "3f2b8c1d-6e4a-4b9f-8c7d-1a2b3c4d5e6f",
  "native_request_id": "item_example_43:appr_1",
  "runtime_turn_id": "turn-0005",
  "attempt": 1,
  "phase": "native_approval",
  "native_tool": "exec_command",
  "tool_id": "coding.git.push",
  "risk": "high",
  "flags": [
    "network",
    "force_push"
  ],
  "preview": "git push --force-with-lease origin agenomic/fix-124",
  "input_digest": "blake3:0c466046a867a45966cd58e6ec0f6d720c5f1511cda32334d6bb68472398a4e0",
  "decision": "defer",
  "effective_mode": "shadow",
  "would_have_been": "pending",
  "reason": "Force push requires approval in enforce; shadow requests none.",
  "reason_codes": [
    "approval_required"
  ],
  "approval_id": null,
  "approval_status": null,
  "record_id": null,
  "status": "decided",
  "outcome": null,
  "created_at": "2026-10-05T09:30:00Z",
  "decided_at": "2026-10-05T09:30:00Z",
  "completed_at": null
}
