{
  "id": "9f0a1b2c-3d4e-4f5a-8b6c-7d8e9f0a1b2c",
  "coding_session_id": "3f2b8c1d-6e4a-4b9f-8c7d-1a2b3c4d5e6f",
  "native_request_id": "toolu_example_01",
  "runtime_turn_id": "turn-0003",
  "attempt": 1,
  "phase": "pre_tool",
  "native_tool": "Bash",
  "tool_id": "coding.fs.delete",
  "risk": "high",
  "flags": [
    "outside_workspace"
  ],
  "preview": "rm -r ../shared-cache",
  "input_digest": "blake3:df3fcdf3ea264d32c7cd37142593a4a93bc7b69529a562a875511229bb530731",
  "decision": "defer",
  "effective_mode": "shadow",
  "would_have_been": "deny",
  "reason": "Deletes outside the workspace; enforce would deny.",
  "reason_codes": [
    "outside_workspace"
  ],
  "approval_id": null,
  "approval_status": null,
  "record_id": "2a3b4c5d-6e7f-4a8b-9c0d-1e2f3a4b5c6d",
  "status": "started",
  "outcome": null,
  "created_at": "2026-10-05T09:02:11Z",
  "decided_at": "2026-10-05T09:02:11Z",
  "completed_at": null
}
