{
  "id": "7c1d2e3f-4a5b-4c6d-8e7f-9a0b1c2d3e4f",
  "coding_session_id": "3f2b8c1d-6e4a-4b9f-8c7d-1a2b3c4d5e6f",
  "native_request_id": "toolu_example_07",
  "attempt": 1,
  "phase": "pre_tool",
  "native_tool": "Write",
  "tool_id": "coding.agent_config.modify",
  "risk": "critical",
  "flags": [
    "agent_config",
    "x_example_flag"
  ],
  "preview": {
    "path": ".claude/settings.json",
    "bytes": 412
  },
  "input_digest": "blake3:e4d501f7df609567076b2bbd416ea4f7375ec7cb67c8fdde65db02a7ba253e1b",
  "decision": "defer",
  "effective_mode": "observe",
  "would_have_been": null,
  "status": "unknown",
  "created_at": "2026-10-05T09:20:00Z"
}
