{
  "id": "4c5d6e7f-8a9b-4c0d-9e1f-2a3b4c5d6e7f",
  "coding_session_id": "3f2b8c1d-6e4a-4b9f-8c7d-1a2b3c4d5e6f",
  "native_request_id": "toolu_example_09",
  "runtime_turn_id": "turn-0007",
  "attempt": 1,
  "phase": "pre_tool",
  "native_tool": "Bash",
  "tool_id": "coding.git.push",
  "risk": "high",
  "flags": [
    "network",
    "force_push"
  ],
  "preview": "git push --force origin main",
  "input_digest": "blake3:52b6752cf5f974d3c5e9e0b4ce2b1ec2adc150a77b3e80199e5a93ec287f463c",
  "patch_digest": null,
  "decision": "pending",
  "effective_mode": "enforce",
  "would_have_been": null,
  "reason": "Force push requires approval.",
  "reason_codes": [
    "approval_required"
  ],
  "approval_id": "6d7e8f9a-0b1c-4d2e-8f3a-4b5c6d7e8f9a",
  "approval_status": "pending",
  "record_id": null,
  "status": "decided",
  "outcome": null,
  "created_at": "2026-10-05T10:15:00Z",
  "decided_at": "2026-10-05T10:15:00Z",
  "completed_at": null
}
